Bus 002 Device 002: ID 046d:c52b
Connected to port: 1
Parent: Bus 002 Device 004: ID 8087:0024
Device Descriptor:
  bLength                 18
  bDescriptorType          1
  bcdUSB                2.00
  bDeviceClass             0 Per Interface
  bDeviceSubClass          0
  bDeviceProtocol          0
  bMaxPacketSize0          8
  idVendor            0x046d
  idProduct           0xc52b
  bcdDevice            12.01
  iManufacturer            1
  iProduct                 2
  iSerial                  0
  bNumConfigurations       1

Configuration Descriptor:
  bLength                  9
  bDescriptorType          2
  wTotalLength            84
  bNumInterfaces           3
  bConfigurationValue      1
  iConfiguration           4
  bmAttributes          0xa0
    (Bus Powered)
    Remote Wakeup
  bMaxPower               98mA

Interface Descriptor:
  bLength                  9
  bDescriptorType          4
  bInterfaceNumber         0
  bAlternateSetting        0
  bNumEndpoints            1
  bInterfaceClass          3 HID
  bInterfaceSubClass       1
  bInterfaceProtocol       1
  iInterface               0

Endpoint Descriptor:
  bLength                  7
  bDescriptorType          5
  bEndpointAddress      0x81  EP 1 IN
  bmAttributes             3
    Transfer Type             Interrupt
    Synch Type                None
    Usage Type                Data
  wMaxPacketSize           8
  bInterval                8

Interface Descriptor:
  bLength                  9
  bDescriptorType          4
  bInterfaceNumber         1
  bAlternateSetting        0
  bNumEndpoints            1
  bInterfaceClass          3 HID
  bInterfaceSubClass       1
  bInterfaceProtocol       2
  iInterface               0

Endpoint Descriptor:
  bLength                  7
  bDescriptorType          5
  bEndpointAddress      0x82  EP 2 IN
  bmAttributes             3
    Transfer Type             Interrupt
    Synch Type                None
    Usage Type                Data
  wMaxPacketSize           8
  bInterval                2

Interface Descriptor:
  bLength                  9
  bDescriptorType          4
  bInterfaceNumber         2
  bAlternateSetting        0
  bNumEndpoints            1
  bInterfaceClass          3 HID
  bInterfaceSubClass       0
  bInterfaceProtocol       0
  iInterface               0

Endpoint Descriptor:
  bLength                  7
  bDescriptorType          5
  bEndpointAddress      0x83  EP 3 IN
  bmAttributes             3
    Transfer Type             Interrupt
    Synch Type                None
    Usage Type                Data
  wMaxPacketSize          32
  bInterval                2

